{
  "format": "open-memory-archive-input-v1",
  "publication": {
    "id": "redacted-family",
    "title": "Redacted Family Archive Demo",
    "author": "Open Memory Archive contributors",
    "locale": "en",
    "privacy": {
      "privacyScope": "public",
      "consentStatus": "not_required",
      "livingPersonStatus": "not_applicable",
      "containsPersonalData": true,
      "containsSpecialCategoryData": false
    }
  },
  "chapters": [
    {
      "id": "chapter-1",
      "title": "Family Gathering",
      "privacy": {
        "privacyScope": "public",
        "consentStatus": "not_required",
        "containsPersonalData": true
      },
      "sections": [
        {
          "id": "section-public",
          "title": "Public context",
          "text": "Grandfather Matti kept a leather-bound notebook. Every evening after the boats came in he wrote down what he saw, who said what, and what the weather was doing. The notebook is now with Anna.",
          "privacy": {
            "privacyScope": "public",
            "consentStatus": "not_required",
            "containsPersonalData": false
          }
        },
        {
          "id": "section-private",
          "title": "Private detail",
          "text": "Anna's mother was estranged from the family between 1988 and 1995. Matti's notebook mentions it three times but Anna asked to keep those pages private.",
          "privateNote": "Anna asked the family to keep this passage in the private archive.",
          "privacy": {
            "privacyScope": "family",
            "consentStatus": "unknown",
            "containsPersonalData": true
          }
        }
      ]
    }
  ],
  "people": [
    {
      "id": "person-living",
      "displayName": "Anna Korhonen",
      "birthDate": "1988-04-12",
      "birthPlace": "Turku, Finland",
      "email": "anna@example.invalid",
      "description": "Anna Korhonen. Lives in Turku. Manages the family's archive and decides what is shared publicly.",
      "biography": "Anna Korhonen. Lives in Turku. Manages the family's archive and decides what is shared publicly.",
      "privacy": {
        "privacyScope": "family",
        "consentStatus": "unknown",
        "livingPersonStatus": "living",
        "containsPersonalData": true,
        "containsSpecialCategoryData": false
      }
    },
    {
      "id": "person-deceased",
      "displayName": "Matti Korhonen",
      "description": "Matti Korhonen (1932-2019). Fisherman, amateur historian, and narrator of this archive.",
      "privacy": {
        "privacyScope": "public",
        "consentStatus": "not_required",
        "livingPersonStatus": "deceased",
        "containsPersonalData": true,
        "containsSpecialCategoryData": false
      }
    }
  ],
  "events": [
    {
      "id": "event-public",
      "title": "Harbour Market Day",
      "date": "1967",
      "description": "Harbour Market Day, summer 1967. Matti's notebook records 52 boats and a queue around the block for smoked vendace.",
      "privacy": {
        "privacyScope": "public",
        "consentStatus": "not_required",
        "containsPersonalData": false
      }
    },
    {
      "id": "event-withdrawn",
      "title": "Withdrawn private event",
      "date": "2024-01-20",
      "description": "Family argument at the summer cottage, July 1991. Consent for this entry was withdrawn by Anna in 2024.",
      "privacy": {
        "privacyScope": "private",
        "consentStatus": "withdrawn",
        "livingPersonStatus": "living",
        "containsPersonalData": true
      }
    }
  ],
  "locations": [
    {
      "id": "location-public",
      "name": "Example Region",
      "country": "Finland",
      "privacy": {
        "privacyScope": "public",
        "consentStatus": "not_required",
        "containsPersonalData": false
      }
    }
  ],
  "media": [
    {
      "id": "media-public",
      "title": "Public sample note",
      "sourcePath": "media/public-note.txt",
      "mediaType": "text/plain",
      "privacy": {
        "privacyScope": "public",
        "consentStatus": "not_required",
        "containsPersonalData": false
      }
    },
    {
      "id": "media-private",
      "title": "Private family recording",
      "sourcePath": "media/private-note.txt",
      "signedUrl": "https://example.invalid/private?signature=private-family-token",
      "mediaType": "text/plain",
      "privacy": {
        "privacyScope": "family",
        "consentStatus": "unknown",
        "livingPersonStatus": "living",
        "containsPersonalData": true
      }
    }
  ],
  "relationships": [
    {
      "id": "rel-1",
      "source": "person-deceased",
      "target": "event-public",
      "type": "remembered"
    }
  ]
}
